{
    "TrackEvents": [
        {
            "start": "2024-10-12T16:00:00.000Z",
            "end": "2024-10-12T16:00:00.000Z",
            "name": "Duel In The Desert",
            "visible": true,
            "cancelled": false,
            "livetimeID": 449043,
            "updatedAt": "2024-10-12T16:00:00.000Z",
            "createdAt": "2024-10-12T16:00:00.000Z"
        },
        {
            "start": "2024-10-26T12:00:00.000Z",
            "end": "2024-10-26T12:00:00.000Z",
            "name": "10/26/2024 Oval Race",
            "visible": true,
            "cancelled": false,
            "livetimeID": 450555,
            "updatedAt": "2024-10-26T12:00:00.000Z",
            "createdAt": "2024-10-26T12:00:00.000Z"
        },
        {
            "start": "2024-11-02T14:00:00.000Z",
            "end": "2024-11-02T14:00:00.000Z",
            "name": "11/02/2024 Oval Race",
            "visible": true,
            "cancelled": false,
            "livetimeID": 451214,
            "updatedAt": "2024-11-02T14:00:00.000Z",
            "createdAt": "2024-11-02T14:00:00.000Z"
        },
        {
            "start": "2024-11-10T00:00:00.000Z",
            "end": "2024-11-10T00:00:00.000Z",
            "name": "11/10/24 18th Scale",
            "visible": true,
            "cancelled": false,
            "livetimeID": 452099,
            "updatedAt": "2024-11-10T00:00:00.000Z",
            "createdAt": "2024-11-10T00:00:00.000Z"
        },
        {
            "start": "2024-11-16T14:00:00.000Z",
            "end": "2024-11-16T14:00:00.000Z",
            "name": "11/16/2024 Oval Race",
            "visible": true,
            "cancelled": false,
            "livetimeID": 452573,
            "updatedAt": "2024-11-16T14:00:00.000Z",
            "createdAt": "2024-11-16T14:00:00.000Z"
        },
        {
            "start": "2024-11-23T00:00:00.000Z",
            "end": "2024-11-23T00:00:00.000Z",
            "name": "11/23/2024",
            "visible": true,
            "cancelled": false,
            "livetimeID": 453270,
            "updatedAt": "2024-11-23T00:00:00.000Z",
            "createdAt": "2024-11-23T00:00:00.000Z"
        },
        {
            "start": "2025-03-07T00:00:00.000Z",
            "end": "2025-03-07T00:00:00.000Z",
            "name": "Sunday Practice",
            "visible": true,
            "cancelled": false,
            "livetimeID": 462581,
            "updatedAt": "2025-03-07T00:00:00.000Z",
            "createdAt": "2025-03-07T00:00:00.000Z"
        },
        {
            "start": "2025-03-09T12:00:00.000Z",
            "end": "2025-03-09T12:00:00.000Z",
            "name": "Sunday Practice",
            "visible": true,
            "cancelled": false,
            "livetimeID": 462512,
            "updatedAt": "2025-03-09T12:00:00.000Z",
            "createdAt": "2025-03-09T12:00:00.000Z"
        },
        {
            "start": "2025-03-16T00:00:00.000Z",
            "end": "2025-03-16T00:00:00.000Z",
            "name": "3/16 Opening Day!",
            "visible": true,
            "cancelled": false,
            "livetimeID": 463584,
            "updatedAt": "2025-03-16T00:00:00.000Z",
            "createdAt": "2025-03-16T00:00:00.000Z"
        },
        {
            "start": "2025-03-22T00:00:00.000Z",
            "end": "2025-03-22T00:00:00.000Z",
            "name": "3/22 Raceday",
            "visible": true,
            "cancelled": false,
            "livetimeID": 464167,
            "updatedAt": "2025-03-22T00:00:00.000Z",
            "createdAt": "2025-03-22T00:00:00.000Z"
        },
        {
            "start": "2025-03-29T00:00:00.000Z",
            "end": "2025-03-29T00:00:00.000Z",
            "name": "3/29 Raceday",
            "visible": true,
            "cancelled": false,
            "livetimeID": 464810,
            "updatedAt": "2025-03-29T00:00:00.000Z",
            "createdAt": "2025-03-29T00:00:00.000Z"
        },
        {
            "start": "2025-04-05T00:00:00.000Z",
            "end": "2025-04-05T00:00:00.000Z",
            "name": "4/5 Raceday",
            "visible": true,
            "cancelled": false,
            "livetimeID": 465455,
            "updatedAt": "2025-04-05T00:00:00.000Z",
            "createdAt": "2025-04-05T00:00:00.000Z"
        },
        {
            "start": "2025-04-12T00:00:00.000Z",
            "end": "2025-04-12T00:00:00.000Z",
            "name": "4/12/25 Raceday",
            "visible": true,
            "cancelled": false,
            "livetimeID": 466136,
            "updatedAt": "2025-04-12T00:00:00.000Z",
            "createdAt": "2025-04-12T00:00:00.000Z"
        },
        {
            "start": "2025-04-27T00:00:00.000Z",
            "end": "2025-04-27T00:00:00.000Z",
            "name": "4/27/25 Raceday",
            "visible": true,
            "cancelled": false,
            "livetimeID": 467630,
            "updatedAt": "2025-04-27T00:00:00.000Z",
            "createdAt": "2025-04-27T00:00:00.000Z"
        },
        {
            "start": "2025-05-03T00:00:00.000Z",
            "end": "2025-05-03T00:00:00.000Z",
            "name": "5/3/2025 Raceday",
            "visible": true,
            "cancelled": false,
            "livetimeID": 468191,
            "updatedAt": "2025-05-03T00:00:00.000Z",
            "createdAt": "2025-05-03T00:00:00.000Z"
        },
        {
            "start": "2025-05-10T00:00:00.000Z",
            "end": "2025-05-10T00:00:00.000Z",
            "name": "05/10/2025 Raceday",
            "visible": true,
            "cancelled": false,
            "livetimeID": 468877,
            "updatedAt": "2025-05-10T00:00:00.000Z",
            "createdAt": "2025-05-10T00:00:00.000Z"
        },
        {
            "start": "2025-06-14T00:00:00.000Z",
            "end": "2025-06-14T00:00:00.000Z",
            "name": "6/14/2025 Raceday",
            "visible": true,
            "cancelled": false,
            "livetimeID": 472332,
            "updatedAt": "2025-06-14T00:00:00.000Z",
            "createdAt": "2025-06-14T00:00:00.000Z"
        },
        {
            "start": "2025-06-21T00:00:00.000Z",
            "end": "2025-06-21T00:00:00.000Z",
            "name": "6/21/2025 Raceday",
            "visible": true,
            "cancelled": false,
            "livetimeID": 473052,
            "updatedAt": "2025-06-21T00:00:00.000Z",
            "createdAt": "2025-06-21T00:00:00.000Z"
        },
        {
            "start": "2025-06-28T00:00:00.000Z",
            "end": "2025-06-28T00:00:00.000Z",
            "name": "06/28/2025 Raceday",
            "visible": true,
            "cancelled": false,
            "livetimeID": 473732,
            "updatedAt": "2025-06-28T00:00:00.000Z",
            "createdAt": "2025-06-28T00:00:00.000Z"
        },
        {
            "start": "2025-07-12T00:00:00.000Z",
            "end": "2025-07-12T00:00:00.000Z",
            "name": "07/12/2025 Raceday",
            "visible": true,
            "cancelled": false,
            "livetimeID": 474961,
            "updatedAt": "2025-07-12T00:00:00.000Z",
            "createdAt": "2025-07-12T00:00:00.000Z"
        },
        {
            "start": "2025-07-19T00:00:00.000Z",
            "end": "2025-07-19T00:00:00.000Z",
            "name": "07/19/2025 Raceday",
            "visible": true,
            "cancelled": false,
            "livetimeID": 475623,
            "updatedAt": "2025-07-19T00:00:00.000Z",
            "createdAt": "2025-07-19T00:00:00.000Z"
        },
        {
            "start": "2025-07-26T00:00:00.000Z",
            "end": "2025-07-26T00:00:00.000Z",
            "name": "07/26/2025",
            "visible": true,
            "cancelled": false,
            "livetimeID": 476166,
            "updatedAt": "2025-07-26T00:00:00.000Z",
            "createdAt": "2025-07-26T00:00:00.000Z"
        },
        {
            "start": "2025-08-02T00:00:00.000Z",
            "end": "2025-08-02T00:00:00.000Z",
            "name": "8/2/2025",
            "visible": true,
            "cancelled": false,
            "livetimeID": 476930,
            "updatedAt": "2025-08-02T00:00:00.000Z",
            "createdAt": "2025-08-02T00:00:00.000Z"
        },
        {
            "start": "2025-08-06T00:00:00.000Z",
            "end": "2025-08-06T00:00:00.000Z",
            "name": "08/06/2025 Sprint Practice",
            "visible": true,
            "cancelled": false,
            "livetimeID": 477293,
            "updatedAt": "2025-08-06T00:00:00.000Z",
            "createdAt": "2025-08-06T00:00:00.000Z"
        },
        {
            "start": "2025-08-16T00:00:00.000Z",
            "end": "2025-08-16T00:00:00.000Z",
            "name": "8/16/2025 Raceday",
            "visible": true,
            "cancelled": false,
            "livetimeID": 478274,
            "updatedAt": "2025-08-16T00:00:00.000Z",
            "createdAt": "2025-08-16T00:00:00.000Z"
        },
        {
            "start": "2025-08-23T00:00:00.000Z",
            "end": "2025-08-23T00:00:00.000Z",
            "name": "8/23/2025 Raceday",
            "visible": true,
            "cancelled": false,
            "livetimeID": 478911,
            "updatedAt": "2025-08-23T00:00:00.000Z",
            "createdAt": "2025-08-23T00:00:00.000Z"
        },
        {
            "start": "2025-09-06T00:00:00.000Z",
            "end": "2025-09-06T00:00:00.000Z",
            "name": "09/06/2025 Raceday",
            "visible": true,
            "cancelled": false,
            "livetimeID": 480204,
            "updatedAt": "2025-09-06T00:00:00.000Z",
            "createdAt": "2025-09-06T00:00:00.000Z"
        },
        {
            "start": "2025-09-13T00:00:00.000Z",
            "end": "2025-09-13T00:00:00.000Z",
            "name": "09/13/2025 Raceday",
            "visible": true,
            "cancelled": false,
            "livetimeID": 480881,
            "updatedAt": "2025-09-13T00:00:00.000Z",
            "createdAt": "2025-09-13T00:00:00.000Z"
        },
        {
            "start": "2025-10-04T00:00:00.000Z",
            "end": "2025-10-04T00:00:00.000Z",
            "name": "10/04/2025 Raceday",
            "visible": true,
            "cancelled": false,
            "livetimeID": 482809,
            "updatedAt": "2025-10-04T00:00:00.000Z",
            "createdAt": "2025-10-04T00:00:00.000Z"
        },
        {
            "start": "2025-10-25T00:00:00.000Z",
            "end": "2025-10-25T00:00:00.000Z",
            "name": "10/25/2025 Raceday",
            "visible": true,
            "cancelled": false,
            "livetimeID": 484857,
            "updatedAt": "2025-10-25T00:00:00.000Z",
            "createdAt": "2025-10-25T00:00:00.000Z"
        },
        {
            "start": "2025-11-01T00:00:00.000Z",
            "end": "2025-11-01T00:00:00.000Z",
            "name": "11/1/2025 Raceday",
            "visible": true,
            "cancelled": false,
            "livetimeID": 485446,
            "updatedAt": "2025-11-01T00:00:00.000Z",
            "createdAt": "2025-11-01T00:00:00.000Z"
        },
        {
            "start": "2025-11-05T00:00:00.000Z",
            "end": "2025-11-05T00:00:00.000Z",
            "name": "Wednesday Night Oval Racing 11/5/2025",
            "visible": true,
            "cancelled": false,
            "livetimeID": 485836,
            "updatedAt": "2025-11-05T00:00:00.000Z",
            "createdAt": "2025-11-05T00:00:00.000Z"
        },
        {
            "start": "2025-11-08T00:00:00.000Z",
            "end": "2025-11-08T00:00:00.000Z",
            "name": "11/8/2025 Raceday",
            "visible": true,
            "cancelled": false,
            "livetimeID": 486205,
            "updatedAt": "2025-11-08T00:00:00.000Z",
            "createdAt": "2025-11-08T00:00:00.000Z"
        },
        {
            "start": "2025-11-12T00:00:00.000Z",
            "end": "2025-11-12T00:00:00.000Z",
            "name": "Wednesday Night Oval 11/12/2025",
            "visible": true,
            "cancelled": false,
            "livetimeID": 486575,
            "updatedAt": "2025-11-12T00:00:00.000Z",
            "createdAt": "2025-11-12T00:00:00.000Z"
        },
        {
            "start": "2025-11-15T00:00:00.000Z",
            "end": "2025-11-15T00:00:00.000Z",
            "name": "11/15/2025 Raceday",
            "visible": true,
            "cancelled": false,
            "livetimeID": 486906,
            "updatedAt": "2025-11-15T00:00:00.000Z",
            "createdAt": "2025-11-15T00:00:00.000Z"
        },
        {
            "start": "2025-11-18T00:00:00.000Z",
            "end": "2025-11-18T00:00:00.000Z",
            "name": "Tuesday Night Carpet Racing",
            "visible": true,
            "cancelled": false,
            "livetimeID": 487210,
            "updatedAt": "2025-11-18T00:00:00.000Z",
            "createdAt": "2025-11-18T00:00:00.000Z"
        },
        {
            "start": "2025-11-22T00:00:00.000Z",
            "end": "2025-11-22T00:00:00.000Z",
            "name": "11/22/2025 Race Day",
            "visible": true,
            "cancelled": false,
            "livetimeID": 487623,
            "updatedAt": "2025-11-22T00:00:00.000Z",
            "createdAt": "2025-11-22T00:00:00.000Z"
        },
        {
            "start": "2025-11-25T00:00:00.000Z",
            "end": "2025-11-25T00:00:00.000Z",
            "name": "11/25/2025 Tuesday Night",
            "visible": true,
            "cancelled": false,
            "livetimeID": 487876,
            "updatedAt": "2025-11-25T00:00:00.000Z",
            "createdAt": "2025-11-25T00:00:00.000Z"
        },
        {
            "start": "2025-12-02T00:00:00.000Z",
            "end": "2025-12-02T00:00:00.000Z",
            "name": "12/2/2025 Tuesday Eve",
            "visible": true,
            "cancelled": false,
            "livetimeID": 488422,
            "updatedAt": "2025-12-02T00:00:00.000Z",
            "createdAt": "2025-12-02T00:00:00.000Z"
        }
    ],
    "LiveTimeEvent": [
        {
            "id": 449043,
            "name": "Duel In The Desert",
            "entries": 10,
            "drivers": 10,
            "laps": 0,
            "startedAt": "2024-10-12T16:00:00.000Z",
            "createdAt": "2024-10-12T16:00:00.000Z",
            "updatedAt": "2024-10-12T16:00:00.000Z"
        },
        {
            "id": 450555,
            "name": "10/26/2024 Oval Race",
            "entries": 17,
            "drivers": 8,
            "laps": 0,
            "startedAt": "2024-10-26T12:00:00.000Z",
            "createdAt": "2024-10-26T12:00:00.000Z",
            "updatedAt": "2024-10-26T12:00:00.000Z"
        },
        {
            "id": 451214,
            "name": "11/02/2024 Oval Race",
            "entries": 12,
            "drivers": 10,
            "laps": 0,
            "startedAt": "2024-11-02T14:00:00.000Z",
            "createdAt": "2024-11-02T14:00:00.000Z",
            "updatedAt": "2024-11-02T14:00:00.000Z"
        },
        {
            "id": 452099,
            "name": "11/10/24 18th Scale",
            "entries": 5,
            "drivers": 5,
            "laps": 0,
            "startedAt": "2024-11-10T00:00:00.000Z",
            "createdAt": "2024-11-10T00:00:00.000Z",
            "updatedAt": "2024-11-10T00:00:00.000Z"
        },
        {
            "id": 452573,
            "name": "11/16/2024 Oval Race",
            "entries": 15,
            "drivers": 11,
            "laps": 0,
            "startedAt": "2024-11-16T14:00:00.000Z",
            "createdAt": "2024-11-16T14:00:00.000Z",
            "updatedAt": "2024-11-16T14:00:00.000Z"
        },
        {
            "id": 453270,
            "name": "11/23/2024",
            "entries": 19,
            "drivers": 10,
            "laps": 0,
            "startedAt": "2024-11-23T00:00:00.000Z",
            "createdAt": "2024-11-23T00:00:00.000Z",
            "updatedAt": "2024-11-23T00:00:00.000Z"
        },
        {
            "id": 462581,
            "name": "Sunday Practice",
            "entries": 15,
            "drivers": 11,
            "laps": 0,
            "startedAt": "2025-03-07T00:00:00.000Z",
            "createdAt": "2025-03-07T00:00:00.000Z",
            "updatedAt": "2025-03-07T00:00:00.000Z"
        },
        {
            "id": 462512,
            "name": "Sunday Practice",
            "entries": 0,
            "drivers": 0,
            "laps": 0,
            "startedAt": "2025-03-09T12:00:00.000Z",
            "createdAt": "2025-03-09T12:00:00.000Z",
            "updatedAt": "2025-03-09T12:00:00.000Z"
        },
        {
            "id": 463584,
            "name": "3/16 Opening Day!",
            "entries": 14,
            "drivers": 10,
            "laps": 0,
            "startedAt": "2025-03-16T00:00:00.000Z",
            "createdAt": "2025-03-16T00:00:00.000Z",
            "updatedAt": "2025-03-16T00:00:00.000Z"
        },
        {
            "id": 464167,
            "name": "3/22 Raceday",
            "entries": 15,
            "drivers": 13,
            "laps": 0,
            "startedAt": "2025-03-22T00:00:00.000Z",
            "createdAt": "2025-03-22T00:00:00.000Z",
            "updatedAt": "2025-03-22T00:00:00.000Z"
        },
        {
            "id": 464810,
            "name": "3/29 Raceday",
            "entries": 20,
            "drivers": 12,
            "laps": 0,
            "startedAt": "2025-03-29T00:00:00.000Z",
            "createdAt": "2025-03-29T00:00:00.000Z",
            "updatedAt": "2025-03-29T00:00:00.000Z"
        },
        {
            "id": 465455,
            "name": "4/5 Raceday",
            "entries": 33,
            "drivers": 20,
            "laps": 0,
            "startedAt": "2025-04-05T00:00:00.000Z",
            "createdAt": "2025-04-05T00:00:00.000Z",
            "updatedAt": "2025-04-05T00:00:00.000Z"
        },
        {
            "id": 466136,
            "name": "4/12/25 Raceday",
            "entries": 25,
            "drivers": 14,
            "laps": 0,
            "startedAt": "2025-04-12T00:00:00.000Z",
            "createdAt": "2025-04-12T00:00:00.000Z",
            "updatedAt": "2025-04-12T00:00:00.000Z"
        },
        {
            "id": 467630,
            "name": "4/27/25 Raceday",
            "entries": 27,
            "drivers": 14,
            "laps": 0,
            "startedAt": "2025-04-27T00:00:00.000Z",
            "createdAt": "2025-04-27T00:00:00.000Z",
            "updatedAt": "2025-04-27T00:00:00.000Z"
        },
        {
            "id": 468191,
            "name": "5/3/2025 Raceday",
            "entries": 25,
            "drivers": 14,
            "laps": 0,
            "startedAt": "2025-05-03T00:00:00.000Z",
            "createdAt": "2025-05-03T00:00:00.000Z",
            "updatedAt": "2025-05-03T00:00:00.000Z"
        },
        {
            "id": 468877,
            "name": "05/10/2025 Raceday",
            "entries": 34,
            "drivers": 21,
            "laps": 0,
            "startedAt": "2025-05-10T00:00:00.000Z",
            "createdAt": "2025-05-10T00:00:00.000Z",
            "updatedAt": "2025-05-10T00:00:00.000Z"
        },
        {
            "id": 472332,
            "name": "6/14/2025 Raceday",
            "entries": 31,
            "drivers": 18,
            "laps": 0,
            "startedAt": "2025-06-14T00:00:00.000Z",
            "createdAt": "2025-06-14T00:00:00.000Z",
            "updatedAt": "2025-06-14T00:00:00.000Z"
        },
        {
            "id": 473052,
            "name": "6/21/2025 Raceday",
            "entries": 34,
            "drivers": 21,
            "laps": 0,
            "startedAt": "2025-06-21T00:00:00.000Z",
            "createdAt": "2025-06-21T00:00:00.000Z",
            "updatedAt": "2025-06-21T00:00:00.000Z"
        },
        {
            "id": 473732,
            "name": "06/28/2025 Raceday",
            "entries": 31,
            "drivers": 20,
            "laps": 0,
            "startedAt": "2025-06-28T00:00:00.000Z",
            "createdAt": "2025-06-28T00:00:00.000Z",
            "updatedAt": "2025-06-28T00:00:00.000Z"
        },
        {
            "id": 474961,
            "name": "07/12/2025 Raceday",
            "entries": 40,
            "drivers": 22,
            "laps": 0,
            "startedAt": "2025-07-12T00:00:00.000Z",
            "createdAt": "2025-07-12T00:00:00.000Z",
            "updatedAt": "2025-07-12T00:00:00.000Z"
        },
        {
            "id": 475623,
            "name": "07/19/2025 Raceday",
            "entries": 37,
            "drivers": 20,
            "laps": 0,
            "startedAt": "2025-07-19T00:00:00.000Z",
            "createdAt": "2025-07-19T00:00:00.000Z",
            "updatedAt": "2025-07-19T00:00:00.000Z"
        },
        {
            "id": 476166,
            "name": "07/26/2025",
            "entries": 52,
            "drivers": 29,
            "laps": 0,
            "startedAt": "2025-07-26T00:00:00.000Z",
            "createdAt": "2025-07-26T00:00:00.000Z",
            "updatedAt": "2025-07-26T00:00:00.000Z"
        },
        {
            "id": 476930,
            "name": "8/2/2025",
            "entries": 46,
            "drivers": 25,
            "laps": 0,
            "startedAt": "2025-08-02T00:00:00.000Z",
            "createdAt": "2025-08-02T00:00:00.000Z",
            "updatedAt": "2025-08-02T00:00:00.000Z"
        },
        {
            "id": 477293,
            "name": "08/06/2025 Sprint Practice",
            "entries": 4,
            "drivers": 4,
            "laps": 0,
            "startedAt": "2025-08-06T00:00:00.000Z",
            "createdAt": "2025-08-06T00:00:00.000Z",
            "updatedAt": "2025-08-06T00:00:00.000Z"
        },
        {
            "id": 478274,
            "name": "8/16/2025 Raceday",
            "entries": 58,
            "drivers": 28,
            "laps": 0,
            "startedAt": "2025-08-16T00:00:00.000Z",
            "createdAt": "2025-08-16T00:00:00.000Z",
            "updatedAt": "2025-08-16T00:00:00.000Z"
        },
        {
            "id": 478911,
            "name": "8/23/2025 Raceday",
            "entries": 29,
            "drivers": 15,
            "laps": 0,
            "startedAt": "2025-08-23T00:00:00.000Z",
            "createdAt": "2025-08-23T00:00:00.000Z",
            "updatedAt": "2025-08-23T00:00:00.000Z"
        },
        {
            "id": 480204,
            "name": "09/06/2025 Raceday",
            "entries": 46,
            "drivers": 22,
            "laps": 0,
            "startedAt": "2025-09-06T00:00:00.000Z",
            "createdAt": "2025-09-06T00:00:00.000Z",
            "updatedAt": "2025-09-06T00:00:00.000Z"
        },
        {
            "id": 480881,
            "name": "09/13/2025 Raceday",
            "entries": 37,
            "drivers": 21,
            "laps": 0,
            "startedAt": "2025-09-13T00:00:00.000Z",
            "createdAt": "2025-09-13T00:00:00.000Z",
            "updatedAt": "2025-09-13T00:00:00.000Z"
        },
        {
            "id": 482809,
            "name": "10/04/2025 Raceday",
            "entries": 41,
            "drivers": 20,
            "laps": 0,
            "startedAt": "2025-10-04T00:00:00.000Z",
            "createdAt": "2025-10-04T00:00:00.000Z",
            "updatedAt": "2025-10-04T00:00:00.000Z"
        },
        {
            "id": 484857,
            "name": "10/25/2025 Raceday",
            "entries": 53,
            "drivers": 21,
            "laps": 0,
            "startedAt": "2025-10-25T00:00:00.000Z",
            "createdAt": "2025-10-25T00:00:00.000Z",
            "updatedAt": "2025-10-25T00:00:00.000Z"
        },
        {
            "id": 485446,
            "name": "11/1/2025 Raceday",
            "entries": 57,
            "drivers": 27,
            "laps": 0,
            "startedAt": "2025-11-01T00:00:00.000Z",
            "createdAt": "2025-11-01T00:00:00.000Z",
            "updatedAt": "2025-11-01T00:00:00.000Z"
        },
        {
            "id": 485836,
            "name": "Wednesday Night Oval Racing 11/5/2025",
            "entries": 12,
            "drivers": 9,
            "laps": 0,
            "startedAt": "2025-11-05T00:00:00.000Z",
            "createdAt": "2025-11-05T00:00:00.000Z",
            "updatedAt": "2025-11-05T00:00:00.000Z"
        },
        {
            "id": 486205,
            "name": "11/8/2025 Raceday",
            "entries": 54,
            "drivers": 24,
            "laps": 0,
            "startedAt": "2025-11-08T00:00:00.000Z",
            "createdAt": "2025-11-08T00:00:00.000Z",
            "updatedAt": "2025-11-08T00:00:00.000Z"
        },
        {
            "id": 486575,
            "name": "Wednesday Night Oval 11/12/2025",
            "entries": 7,
            "drivers": 7,
            "laps": 0,
            "startedAt": "2025-11-12T00:00:00.000Z",
            "createdAt": "2025-11-12T00:00:00.000Z",
            "updatedAt": "2025-11-12T00:00:00.000Z"
        },
        {
            "id": 486906,
            "name": "11/15/2025 Raceday",
            "entries": 17,
            "drivers": 13,
            "laps": 0,
            "startedAt": "2025-11-15T00:00:00.000Z",
            "createdAt": "2025-11-15T00:00:00.000Z",
            "updatedAt": "2025-11-15T00:00:00.000Z"
        },
        {
            "id": 487210,
            "name": "Tuesday Night Carpet Racing",
            "entries": 12,
            "drivers": 8,
            "laps": 0,
            "startedAt": "2025-11-18T00:00:00.000Z",
            "createdAt": "2025-11-18T00:00:00.000Z",
            "updatedAt": "2025-11-18T00:00:00.000Z"
        },
        {
            "id": 487623,
            "name": "11/22/2025 Race Day",
            "entries": 20,
            "drivers": 11,
            "laps": 0,
            "startedAt": "2025-11-22T00:00:00.000Z",
            "createdAt": "2025-11-22T00:00:00.000Z",
            "updatedAt": "2025-11-22T00:00:00.000Z"
        },
        {
            "id": 487876,
            "name": "11/25/2025 Tuesday Night",
            "entries": 21,
            "drivers": 17,
            "laps": 0,
            "startedAt": "2025-11-25T00:00:00.000Z",
            "createdAt": "2025-11-25T00:00:00.000Z",
            "updatedAt": "2025-11-25T00:00:00.000Z"
        },
        {
            "id": 488422,
            "name": "12/2/2025 Tuesday Eve",
            "entries": 13,
            "drivers": 10,
            "laps": 0,
            "startedAt": "2025-12-02T00:00:00.000Z",
            "createdAt": "2025-12-02T00:00:00.000Z",
            "updatedAt": "2025-12-02T00:00:00.000Z"
        }
    ]
}